Question,Answer
Describe the role of paging and segmentation in memory management.
Explain how the Banker's algorithm prevents deadlock. Provide an example.
How does Round Robin scheduling differ from Shortest Job First (SJF) scheduling?
"Explain the concept of ""thrashing"" in virtual memory management and how it can be prevented."
What is the difference between a monolithic kernel and a microkernel?
How does the operating system handle interrupts? Explain the interrupt handling process.
"Discuss the pros and cons of various disk scheduling algorithms (e.g., FCFS, SSTF, SCAN)."
Explain the process of context switching. What factors impact its performance?
"What is the significance of the producer-consumer problem in process synchronization, and how is it solved?"
"Explain the concept of ""paging"" in detail and how it helps in efficient memory management."